<?xml version="1.0"?>
<root
        xmlns:xsi="http://www.w3.org/2001/XMLSchema-instance"
        xsi:noNamespaceSchemaLocation="../../../main/resources/cosy.xsd">

    <!--
    author: Sven Schneider
    copyright: all rights reserved, 2018
    -->

    <string_symbol id="event_a" string="a"/>
    <string_symbol id="event_b" string="b"/>
    <string_symbol id="event_u" string="u"/>

    <string_symbol id="box" string="☐"/>
    <string_symbol id="bullet" string="•"/>
    <string_symbol id="state_0" string="q0"/>
    <string_symbol id="state_1" string="q1"/>
    <string_symbol id="state_2" string="q2"/>

    <epda_step_label id="edge_0" edge_src="state_0" edge_event="event_b" edge_pop="box" edge_push="bullet box"
                     edge_trg="state_0"/>
    <epda_step_label id="edge_1" edge_src="state_0" edge_event="event_b" edge_pop="bullet" edge_push="bullet bullet"
                     edge_trg="state_0"/>
    <epda_step_label id="edge_2" edge_src="state_0" edge_event="event_a" edge_pop="box" edge_push="box"
                     edge_trg="state_1"/>
    <epda_step_label id="edge_3" edge_src="state_0" edge_event="event_a" edge_pop="bullet" edge_push="bullet"
                     edge_trg="state_1"/>
    <epda_step_label id="edge_4" edge_src="state_1" edge_event="event_u" edge_pop="bullet" edge_trg="state_2"/>
    <epda_step_label id="edge_5" edge_src="state_2" edge_event="event_a" edge_pop="bullet" edge_push="bullet"
                     edge_trg="state_1"/>
    <epda_step_label id="edge_6" edge_src="state_2" edge_event="event_a" edge_pop="box" edge_push="box"
                     edge_trg="state_1"/>

    <epda
            id="spec"
            epda_states="state_0 state_1 state_2"
            epda_events="event_a event_b event_u"
            epda_gamma="box bullet"
            epda_delta="edge_0 edge_1 edge_2 edge_3 edge_4 edge_5 edge_6"
            epda_initial="state_0"
            epda_eos="box"
            epda_marking="state_1"/>

    <epda_step_label id="edgep_0" edge_src="state_0" edge_event="event_b" edge_pop="box" edge_push="box"
                     edge_trg="state_0"/>
    <epda_step_label id="edgep_1" edge_src="state_0" edge_event="event_a" edge_pop="box" edge_push="box"
                     edge_trg="state_1"/>
    <epda_step_label id="edgep_2" edge_src="state_1" edge_event="event_u" edge_pop="box" edge_push="box"
                     edge_trg="state_2"/>
    <epda_step_label id="edgep_3" edge_src="state_2" edge_event="event_a" edge_pop="box" edge_push="box"
                     edge_trg="state_1"/>

    <epda
            id="plant"
            epda_states="state_0 state_1 state_2"
            epda_events="event_a event_b event_u"
            epda_gamma="box"
            epda_delta="edgep_0 edgep_1 edgep_2 edgep_3"
            epda_initial="state_0"
            epda_eos="box"
            epda_marking="state_1"/>

    <!-- sigmaUC -->
    <sigma_uncontrollable id="sigmaUC" elements="event_u"/>

</root>
