<?xml version="1.0"?>
<root
        xmlns:xsi="http://www.w3.org/2001/XMLSchema-instance"
        xsi:noNamespaceSchemaLocation="../../../main/resources/cosy.xsd">

    <!--
    author: Sven Schneider
    copyright: all rights reserved, 2018
    -->

    <string_symbol id="event_a" string="a"/>
    <string_symbol id="event_b" string="b"/>
    <string_symbol id="nonterminal_S" string="S"/>
    <string_symbol id="nonterminal_P" string="P"/>
    <string_symbol id="nonterminal_A" string="A"/>

    <two_elements__teB id="a" value="event_a"/>
    <two_elements__teB id="b" value="event_b"/>

    <two_elements__teA id="S" value="nonterminal_S"/>
    <two_elements__teA id="P" value="nonterminal_P"/>
    <two_elements__teA id="A" value="nonterminal_A"/>
    <cfg_step_label id="prod_0" prod_lhs="nonterminal_S"/>
    <cfg_step_label id="prod_1" prod_lhs="nonterminal_S" prod_rhs="a S"/>
    <cfg_step_label id="prod_2" prod_lhs="nonterminal_S" prod_rhs="a A P"/>
    <cfg_step_label id="prod_3" prod_lhs="nonterminal_P" prod_rhs="b"/>
    <cfg_step_label id="prod_4" prod_lhs="nonterminal_P" prod_rhs="b a"/>
    <cfg_step_label id="prod_5" prod_lhs="nonterminal_S" prod_rhs="A"/>
    <cfg_step_label id="prod_6" prod_lhs="nonterminal_A" prod_rhs="a A b a a"/>
    <cfg_step_label id="prod_7" prod_lhs="nonterminal_A"/>

    <cfg
            id="input"
            cfg_nonterminals="nonterminal_S nonterminal_P nonterminal_A"
            cfg_events="event_a event_b"
            cfg_initial="nonterminal_S"
            cfg_step_labels="prod_0 prod_1 prod_2 prod_3 prod_4 prod_5 prod_6 prod_7"/>

</root>
