<?xml version="1.0"?>
<root
        xmlns:xsi="http://www.w3.org/2001/XMLSchema-instance"
        xsi:noNamespaceSchemaLocation="../../../main/resources/cosy.xsd">

    <!--
    author: Sven Schneider
    copyright: all rights reserved, 2018
    -->

    <string_symbol id="event_b" string="b"/>
    <string_symbol id="event_c" string="c"/>
    <string_symbol id="event_d" string="d"/>
    <string_symbol id="nonterminal_S" string="S"/>
    <string_symbol id="nonterminal_E" string="E"/>
    <string_symbol id="nonterminal_D" string="D"/>
    <string_symbol id="nonterminal_B" string="B"/>
    <string_symbol id="nonterminal_C" string="C"/>
    <string_symbol id="nonterminal_A" string="A"/>
    <string_symbol id="nonterminal_F" string="F"/>

    <two_elements__teB id="b" value="event_b"/>
    <two_elements__teB id="c" value="event_c"/>
    <two_elements__teB id="d" value="event_d"/>

    <two_elements__teA id="S" value="nonterminal_S"/>
    <two_elements__teA id="E" value="nonterminal_E"/>
    <two_elements__teA id="D" value="nonterminal_D"/>
    <two_elements__teA id="B" value="nonterminal_B"/>
    <two_elements__teA id="C" value="nonterminal_C"/>
    <two_elements__teA id="A" value="nonterminal_A"/>
    <two_elements__teA id="F" value="nonterminal_F"/>
    <cfg_step_label id="prod_0" prod_lhs="nonterminal_S" prod_rhs="E"/>
    <cfg_step_label id="prod_1" prod_lhs="nonterminal_E" prod_rhs="E"/>
    <cfg_step_label id="prod_2" prod_lhs="nonterminal_E" prod_rhs="F"/>
    <cfg_step_label id="prod_3" prod_lhs="nonterminal_E" prod_rhs="C D"/>
    <cfg_step_label id="prod_4" prod_lhs="nonterminal_D" prod_rhs="d B"/>
    <cfg_step_label id="prod_5" prod_lhs="nonterminal_C" prod_rhs="A c"/>
    <cfg_step_label id="prod_6" prod_lhs="nonterminal_B" prod_rhs="b"/>
    <cfg_step_label id="prod_7" prod_lhs="nonterminal_A"/>
    <cfg
            id="input"
            cfg_nonterminals="nonterminal_S nonterminal_E nonterminal_D nonterminal_B nonterminal_C nonterminal_A nonterminal_F"
            cfg_events="event_b event_c event_d"
            cfg_initial="nonterminal_S"
            cfg_step_labels="prod_0 prod_1 prod_2 prod_3 prod_4 prod_5 prod_6 prod_7"/>

</root>
